[
  {"id":"fact-address","category":"character","subject":"도희","statement":"친밀도가 높아질수록 민준을 부르는 호칭이 짧아진다.","status":"OBSERVED","confidence":1,"evidence":[{"sourceId":"src-fixture","fileName":"합성예제.md","chapter":"1장 첫 만남","paragraph":1,"paragraphHash":"04f3ec88cf0bb2729ae7828cf8d6a0151542d90cecafda40baa7510082c94a3c","excerpt":"도희는 아직 거리를 둔 채 민준을 선생님이라고 불렀다."}],"tags":["호칭","관계"]}
]
